Game,Team,W/L,TMP,FGM,FGA,FGP,3PM,3PA,3PP,FTM,FTA,FTP,ORB,DRB,TRB,AST,STL,BLK,TOV,TPF,PTS,x,y
Los Angeles Clippers at Minnesota Timberwolves, Los Angeles Clippers, W, 240, 38, 86, .442, 8, 25, .320, 26, 29, .897, 13, 30, 43, 21, 10, 9, 17, 26, 110  ,140.451166948,59.6417262643
Los Angeles Clippers at Minnesota Timberwolves, Minnesota Timberwolve, L, 240, 36, 82, .439, 7, 18, .389, 27, 35, .771, 11, 35, 46, 18, 10, 3, 18, 29, 106  ,133.748696299,57.7526385802
Boston Celtics at New Orleans Pelicans, Boston Celtics, W, 240, 40, 81, .494, 12, 28, .429, 19, 24, .792, 10, 36, 46, 24, 8, 8, 17, 18, 111  ,142.78653491,57.324964954
Boston Celtics at New Orleans Pelicans, New Orleans Pelican, L, 240, 37, 90, .411, 4, 13, .308, 15, 18, .833, 13, 31, 44, 21, 8, 6, 14, 17, 93  ,124.126562928,64.1880695592
Dallas Mavericks at New York Knicks, Dallas Mavericks, W, 240, 37, 82, .451, 13, 31, .419, 17, 20, .850, 7, 36, 43, 21, 7, 3, 9, 14, 104  ,135.539209031,58.1389772756
Dallas Mavericks at New York Knicks, New York Knick, L, 240, 40, 84, .476, 9, 25, .360, 8, 9, .889, 3, 34, 37, 25, 4, 4, 13, 21, 97  ,129.69406789,54.4677761428
San Antonio Spurs at Philadelphia 76ers, San Antonio Spurs, W, 240, 47, 76, .618, 4, 11, .364, 21, 25, .840, 7, 40, 47, 32, 4, 1, 7, 17, 119  ,148.910492543,46.5015219434
San Antonio Spurs at Philadelphia 76ers, Philadelphia 76er, L, 240, 26, 75, .347, 4, 24, .167, 12, 21, .571, 6, 25, 31, 14, 3, 1, 13, 25, 68  ,94.3436911861,54.8227963465
Los Angeles Lakers at Toronto Raptors, Los Angeles Lakers, L, 240, 34, 83, .410, 7, 19, .368, 18, 20, .900, 14, 33, 47, 14, 4, 4, 15, 23, 93  ,121.579952818,63.93390697
Los Angeles Lakers at Toronto Raptors, Toronto Raptor, W, 240, 34, 74, .459, 9, 25, .360, 25, 32, .781, 8, 30, 38, 18, 7, 2, 7, 13, 102  ,128.379253604,49.7971185786
Houston Rockets at Brooklyn Nets, Houston Rockets, L, 240, 39, 82, .476, 15, 35, .429, 12, 17, .706, 10, 26, 36, 26, 20, 3, 23, 15, 105  ,138.574021339,55.2820523157
Houston Rockets at Brooklyn Nets, Brooklyn Net, W, 240, 45, 81, .556, 7, 18, .389, 13, 16, .813, 12, 30, 42, 27, 14, 7, 24, 17, 110  ,141.653804882,52.9618205861
Portland Trail Blazers at Cleveland Cavaliers, Portland Trail Blazers, L, 240, 40, 79, .506, 11, 26, .423, 9, 16, .563, 10, 26, 36, 21, 3, 2, 18, 25, 100  ,130.735284898,52.7452578411
Portland Trail Blazers at Cleveland Cavaliers, Cleveland Cavalier, W, 240, 40, 79, .506, 9, 21, .429, 16, 20, .800, 6, 24, 30, 18, 10, 4, 8, 18, 105  ,132.485213279,45.6594147545
Orlando Magic at Denver Nuggets, Orlando Magic, W, 240, 38, 88, .432, 1, 16, .063, 8, 10, .800, 10, 44, 54, 14, 9, 8, 20, 19, 85  ,116.364039091,71.0874123494
Orlando Magic at Denver Nuggets, Denver Nugget, L, 240, 28, 84, .333, 7, 24, .292, 11, 20, .550, 10, 37, 47, 19, 11, 7, 17, 16, 74  ,105.505452076,69.2294633019
Golden State Warriors at Indiana Pacers, Golden State Warriors, W, 240, 52, 95, .547, 16, 35, .457, 11, 15, .733, 10, 36, 46, 29, 10, 6, 15, 19, 131  ,169.748967106,62.0541509651
Golden State Warriors at Indiana Pacers, Indiana Pacer, L, 240, 44, 100, .440, 14, 33, .424, 21, 26, .808, 16, 28, 44, 23, 8, 3, 16, 18, 123  ,159.41637756,68.4602711615
Oklahoma City Thunder at Memphis Grizzlies, Oklahoma City Thunder, W, 240, 47, 84, .560, 13, 26, .500, 18, 23, .783, 10, 36, 46, 31, 11, 3, 12, 17, 125  ,159.216060555,54.3110200471
Oklahoma City Thunder at Memphis Grizzlies, Memphis Grizzlie, L, 240, 33, 81, .407, 3, 14, .214, 19, 22, .864, 11, 22, 33, 14, 6, 4, 15, 17, 88  ,113.696364612,53.5839304598
Utah Jazz at Sacramento Kings, Utah Jazz, L, 240, 38, 92, .413, 15, 36, .417, 15, 22, .682, 19, 25, 44, 23, 7, 0, 12, 22, 106  ,141.872467223,69.6262977911
Utah Jazz at Sacramento Kings, Sacramento King, W, 240, 43, 77, .558, 10, 28, .357, 18, 24, .750, 9, 31, 40, 29, 6, 2, 15, 18, 114  ,145.729467445,49.6364325683
Chicago Bulls at Boston Celtics, Chicago Bulls, L, 240, 39, 91, .429, 6, 21, .286, 16, 23, .696, 15, 35, 50, 22, 7, 5, 16, 18, 100  ,133.424210849,69.0358663309
Chicago Bulls at Boston Celtics, Boston Celtic, W, 240, 38, 92, .413, 5, 23, .217, 24, 28, .857, 13, 32, 45, 22, 10, 4, 12, 22, 105  ,137.22299489,65.3910308025
Miami Heat at Charlotte Hornets, Miami Heat, L, 240, 29, 75, .387, 6, 21, .286, 17, 24, .708, 7, 36, 43, 17, 3, 8, 17, 14, 81  ,108.199674102,57.6983733157
Miami Heat at Charlotte Hornets, Charlotte Hornet, W, 240, 40, 81, .494, 11, 27, .407, 8, 17, .471, 3, 37, 40, 27, 9, 5, 10, 21, 99  ,132.117601152,54.101953427
Atlanta Hawks at Dallas Mavericks, Atlanta Hawks, W, 240, 39, 81, .481, 6, 20, .300, 14, 18, .778, 6, 41, 47, 26, 7, 7, 14, 19, 98  ,129.693363171,57.8283855936
Atlanta Hawks at Dallas Mavericks, Dallas Maverick, L, 240, 36, 100, .360, 7, 31, .226, 16, 19, .842, 20, 31, 51, 18, 7, 3, 9, 15, 95  ,131.202880326,81.2941878332
Memphis Grizzlies at Detroit Pistons, Memphis Grizzlies, W, 240, 41, 88, .466, 4, 15, .267, 7, 13, .538, 16, 37, 53, 23, 4, 4, 17, 15, 93  ,126.746168063,69.2996347569
Memphis Grizzlies at Detroit Pistons, Detroit Piston, L, 240, 37, 87, .425, 8, 29, .276, 10, 15, .667, 13, 30, 43, 17, 9, 6, 12, 16, 92  ,124.587804634,66.2408533352
Los Angeles Clippers at Milwaukee Bucks, Los Angeles Clippers, W, 240, 38, 81, .469, 12, 28, .429, 21, 36, .583, 12, 39, 51, 27, 7, 8, 14, 16, 109  ,141.739200938,61.2551142811
Los Angeles Clippers at Milwaukee Bucks, Milwaukee Buck, L, 240, 42, 90, .467, 2, 10, .200, 9, 12, .750, 7, 33, 40, 26, 7, 1, 11, 29, 95  ,127.302848006,58.0188757984
Los Angeles Lakers at Minnesota Timberwolves, Los Angeles Lakers, L, 265, 48, 93, .516, 9, 23, .391, 17, 27, .630, 9, 31, 40, 19, 9, 1, 9, 23, 122  ,154.373523637,57.2436587461
Los Angeles Lakers at Minnesota Timberwolves, Minnesota Timberwolve, W, 265, 46, 93, .495, 7, 19, .368, 24, 31, .774, 14, 33, 47, 30, 4, 4, 14, 20, 123  ,157.251577295,60.9276731938
Orlando Magic at Phoenix Suns, Orlando Magic, L, 240, 40, 85, .471, 12, 25, .480, 12, 16, .750, 5, 27, 32, 28, 11, 1, 16, 26, 104  ,136.643159821,50.8012650951
Orlando Magic at Phoenix Suns, Phoenix Sun, W, 240, 41, 80, .513, 6, 24, .250, 19, 27, .704, 11, 33, 44, 23, 9, 6, 18, 16, 107  ,137.5738008,55.938147782
San Antonio Spurs at Toronto Raptors, San Antonio Spurs, L, 240, 34, 76, .447, 7, 25, .280, 19, 24, .792, 13, 22, 35, 23, 10, 2, 17, 19, 94  ,122.795069719,52.6250870615
San Antonio Spurs at Toronto Raptors, Toronto Raptor, W, 240, 37, 64, .578, 3, 10, .300, 20, 22, .909, 4, 30, 34, 23, 10, 2, 20, 24, 97  ,120.307857529,36.7192518489
New York Knicks at Utah Jazz, New York Knicks, L, 240, 31, 78, .397, 8, 21, .381, 15, 27, .556, 7, 29, 36, 20, 10, 3, 10, 24, 85  ,113.256270068,54.1823726518
New York Knicks at Utah Jazz, Utah Jaz, W, 240, 39, 80, .488, 9, 21, .429, 19, 23, .826, 9, 42, 51, 26, 6, 2, 14, 26, 106  ,137.396769006,58.6904098512
Houston Rockets at Washington Wizards, Houston Rockets, W, 240, 40, 83, .482, 12, 33, .364, 17, 25, .680, 6, 36, 42, 23, 8, 4, 19, 23, 109  ,141.528984036,56.8182475007
Houston Rockets at Washington Wizards, Washington Wizard, L, 240, 39, 89, .438, 5, 25, .200, 20, 24, .833, 11, 36, 47, 20, 8, 3, 18, 25, 103  ,135.108197586,65.0983161141
Philadelphia 76ers at Brooklyn Nets, Philadelphia 76ers, L, 240, 34, 87, .391, 4, 31, .129, 19, 22, .864, 13, 25, 38, 17, 14, 6, 10, 22, 91  ,122.035688567,64.2475139494
Philadelphia 76ers at Brooklyn Nets, Brooklyn Net, W, 240, 37, 74, .500, 6, 14, .429, 20, 27, .741, 9, 34, 43, 22, 5, 1, 19, 20, 100  ,126.983664925,50.3533596804
Los Angeles Clippers at Chicago Bulls, Los Angeles Clippers, L, 240, 30, 88, .341, 10, 22, .455, 10, 12, .833, 15, 37, 52, 22, 4, 4, 13, 15, 80  ,113.684598667,73.9775282251
Los Angeles Clippers at Chicago Bulls, Chicago Bull, W, 240, 31, 87, .356, 7, 23, .304, 14, 16, .875, 13, 41, 54, 20, 8, 6, 11, 12, 83  ,115.721859264,73.4748432263
Atlanta Hawks at Oklahoma City Thunder, Atlanta Hawks, L, 240, 35, 78, .449, 10, 28, .357, 14, 23, .609, 5, 29, 34, 21, 9, 7, 9, 19, 94  ,123.591898757,51.5572898656
Atlanta Hawks at Oklahoma City Thunder, Oklahoma City Thunde, W, 240, 39, 80, .488, 9, 17, .529, 20, 26, .769, 10, 42, 52, 24, 6, 2, 14, 16, 107  ,137.26763439,58.4999678759
New York Knicks at Sacramento Kings, New York Knicks, L, 240, 33, 83, .398, 9, 29, .310, 22, 28, .786, 13, 41, 54, 17, 9, 6, 18, 22, 97  ,127.934800222,68.9782748084
New York Knicks at Sacramento Kings, Sacramento King, W, 240, 42, 93, .452, 3, 16, .188, 12, 16, .750, 10, 34, 44, 24, 6, 3, 12, 20, 99  ,132.489585229,63.9138643492
Golden State Warriors at Boston Celtics, Golden State Warriors, W, 290, 42, 107, .393, 9, 31, .290, 31, 39, .795, 17, 50, 67, 28, 10, 11, 18, 22, 124  ,163.733709826,85.6946576346
Golden State Warriors at Boston Celtics, Boston Celtic, L, 290, 49, 114, .430, 12, 33, .364, 9, 16, .563, 11, 40, 51, 32, 7, 9, 15, 30, 119  ,163.170527763,80.0244407434
Minnesota Timberwolves at Denver Nuggets, Minnesota Timberwolves, L, 265, 38, 87, .437, 7, 19, .368, 25, 29, .862, 8, 35, 43, 22, 5, 8, 10, 27, 108  ,137.9574618,57.5756950409
Minnesota Timberwolves at Denver Nuggets, Denver Nugget, W, 265, 38, 86, .442, 11, 28, .393, 24, 33, .727, 8, 42, 50, 21, 7, 1, 12, 25, 111  ,142.724488109,62.5653393647
Miami Heat at Indiana Pacers, Miami Heat, L, 240, 35, 81, .432, 5, 20, .250, 8, 13, .615, 8, 37, 45, 14, 6, 8, 19, 16, 83  ,112.35956643,62.2828941586
Miami Heat at Indiana Pacers, Indiana Pacer, W, 240, 36, 86, .419, 6, 28, .214, 18, 20, .900, 7, 38, 45, 22, 13, 6, 12, 13, 96  ,128.257564033,63.1888882066
Charlotte Hornets at Memphis Grizzlies, Charlotte Hornets, W, 240, 39, 78, .500, 18, 37, .486, 27, 30, .900, 7, 34, 41, 23, 5, 5, 13, 24, 123  ,153.485078027,50.7761740468
Charlotte Hornets at Memphis Grizzlies, Memphis Grizzlie, L, 240, 32, 80, .400, 7, 20, .350, 28, 37, .757, 11, 29, 40, 19, 8, 5, 12, 24, 99  ,126.000547372,55.3444429605
Washington Wizards at New Orleans Pelicans, Washington Wizards, L, 240, 40, 80, .500, 12, 27, .444, 13, 21, .619, 6, 27, 33, 27, 10, 1, 10, 17, 105  ,136.579712707,48.8185180758
Washington Wizards at New Orleans Pelicans, New Orleans Pelican, W, 240, 39, 79, .494, 16, 27, .593, 13, 18, .722, 7, 34, 41, 21, 9, 0, 16, 18, 107  ,137.66618891,53.1530287385
Cleveland Cavaliers at Orlando Magic, Cleveland Cavaliers, W, 240, 41, 72, .569, 11, 21, .524, 18, 27, .667, 9, 36, 45, 28, 12, 0, 18, 19, 111  ,140.697338075,48.4928778036
Cleveland Cavaliers at Orlando Magic, Orlando Magi, L, 240, 28, 72, .389, 6, 22, .273, 14, 20, .700, 6, 24, 30, 16, 8, 3, 19, 24, 76  ,101.516307649,49.4992428108
Detroit Pistons at Philadelphia 76ers, Detroit Pistons, W, 240, 43, 93, .462, 10, 27, .370, 11, 16, .688, 17, 31, 48, 18, 9, 9, 14, 21, 107  ,141.526723983,69.6512741284
Detroit Pistons at Philadelphia 76ers, Philadelphia 76er, L, 240, 36, 80, .450, 6, 18, .333, 17, 24, .708, 13, 31, 44, 22, 5, 5, 21, 16, 95  ,124.591085438,58.4389680291
Portland Trail Blazers at Phoenix Suns, Portland Trail Blazers, W, 240, 45, 96, .469, 12, 34, .353, 4, 7, .571, 14, 37, 51, 23, 7, 3, 12, 14, 106  ,144.780501748,73.8641603065
Portland Trail Blazers at Phoenix Suns, Phoenix Sun, L, 240, 36, 83, .434, 13, 35, .371, 11, 18, .611, 8, 32, 40, 21, 8, 7, 9, 9, 96  ,128.958660466,60.4481991094
Los Angeles Lakers at San Antonio Spurs, Los Angeles Lakers, L, 240, 36, 88, .409, 9, 25, .360, 6, 10, .600, 9, 27, 36, 20, 7, 5, 15, 21, 87  ,119.633123721,61.5513275667
Los Angeles Lakers at San Antonio Spurs, San Antonio Spur, W, 240, 44, 82, .537, 6, 14, .429, 15, 25, .600, 11, 38, 49, 26, 9, 6, 13, 13, 109  ,140.35102708,56.7445927433
Milwaukee Bucks at Toronto Raptors, Milwaukee Bucks, L, 240, 33, 80, .413, 4, 11, .364, 13, 16, .813, 10, 30, 40, 19, 9, 4, 15, 19, 83  ,110.748473972,56.8048729982
Milwaukee Bucks at Toronto Raptors, Toronto Raptor, W, 240, 34, 70, .486, 7, 20, .350, 15, 23, .652, 7, 32, 39, 16, 9, 8, 16, 23, 90  ,115.714574359,49.4479520626
Oklahoma City Thunder at Utah Jazz, Oklahoma City Thunder, W, 240, 37, 79, .468, 6, 17, .353, 14, 16, .875, 11, 34, 45, 14, 4, 2, 13, 19, 94  ,121.737718896,58.323179805
Oklahoma City Thunder at Utah Jazz, Utah Jaz, L, 240, 33, 78, .423, 8, 28, .286, 16, 24, .667, 11, 28, 39, 17, 7, 4, 11, 16, 90  ,118.966909957,57.8846753022
San Antonio Spurs at Atlanta Hawks, San Antonio Spurs, W, 240, 36, 74, .486, 10, 20, .500, 21, 22, .955, 6, 43, 49, 26, 11, 2, 23, 16, 103  ,132.214377553,53.3095526139
San Antonio Spurs at Atlanta Hawks, Atlanta Hawk, L, 240, 30, 80, .375, 5, 24, .208, 13, 16, .813, 7, 26, 33, 21, 15, 3, 17, 15, 78  ,107.389792813,56.2475894583
Los Angeles Clippers at Brooklyn Nets, Los Angeles Clippers, W, 240, 43, 86, .500, 8, 24, .333, 11, 18, .611, 7, 33, 40, 28, 12, 0, 12, 21, 105  ,138.817845309,56.1641183128
Los Angeles Clippers at Brooklyn Nets, Brooklyn Net, L, 240, 35, 79, .443, 5, 19, .263, 25, 30, .833, 12, 34, 46, 17, 5, 2, 16, 22, 100  ,127.284422274,58.0669979319
New Orleans Pelicans at Chicago Bulls, New Orleans Pelicans, L, 240, 40, 89, .449, 6, 16, .375, 8, 11, .727, 5, 36, 41, 26, 9, 6, 10, 22, 94  ,127.122463207,59.122825349
New Orleans Pelicans at Chicago Bulls, Chicago Bull, W, 240, 33, 78, .423, 8, 20, .400, 24, 29, .828, 7, 41, 48, 17, 6, 6, 13, 10, 98  ,125.320333369,57.7765493321
Boston Celtics at Charlotte Hornets, Boston Celtics, W, 240, 40, 96, .417, 9, 25, .360, 9, 10, .900, 3, 39, 42, 26, 5, 5, 5, 13, 98  ,133.982011285,64.7864218164
Boston Celtics at Charlotte Hornets, Charlotte Hornet, L, 240, 36, 88, .409, 11, 35, .314, 10, 10, 1.000, 7, 45, 52, 17, 1, 5, 11, 12, 93  ,127.40306727,71.4485539093
Washington Wizards at Dallas Mavericks, Washington Wizards, W, 240, 44, 85, .518, 14, 29, .483, 12, 15, .800, 4, 35, 39, 33, 6, 6, 13, 22, 114  ,149.273070361,52.4254696013
Washington Wizards at Dallas Mavericks, Dallas Maverick, L, 240, 38, 89, .427, 14, 33, .424, 21, 24, .875, 11, 35, 46, 23, 5, 3, 12, 12, 111  ,144.79871298,64.2203455498
Indiana Pacers at Detroit Pistons, Indiana Pacers, L, 240, 41, 82, .500, 3, 16, .188, 11, 18, .611, 5, 28, 33, 17, 7, 2, 16, 16, 96  ,124.15815809,50.1356113717
Indiana Pacers at Detroit Pistons, Detroit Piston, W, 240, 45, 90, .500, 13, 29, .448, 15, 19, .789, 10, 36, 46, 26, 11, 6, 14, 18, 118  ,153.174187174,61.2058292325
Los Angeles Lakers at Houston Rockets, Los Angeles Lakers, L, 240, 35, 88, .398, 10, 32, .313, 17, 20, .850, 11, 29, 40, 21, 11, 4, 19, 23, 97  ,129.828187029,63.7132113111
Los Angeles Lakers at Houston Rockets, Houston Rocket, W, 240, 47, 90, .522, 15, 33, .455, 17, 28, .607, 15, 37, 52, 32, 16, 7, 16, 15, 126  ,163.805945637,64.7286620681
Golden State Warriors at Milwaukee Bucks, Golden State Warriors, L, 240, 36, 89, .404, 6, 27, .222, 17, 25, .680, 15, 34, 49, 23, 9, 8, 16, 20, 95  ,128.829503311,69.9993350871
Golden State Warriors at Milwaukee Bucks, Milwaukee Buck, W, 240, 44, 90, .489, 6, 14, .429, 14, 18, .778, 8, 36, 44, 31, 12, 4, 16, 24, 108  ,141.918903216,57.8546120606
New York Knicks at Portland Trail Blazers, New York Knicks, W, 240, 39, 75, .520, 9, 21, .429, 25, 28, .893, 7, 27, 34, 17, 3, 3, 11, 22, 112  ,137.450792865,44.0854320249
New York Knicks at Portland Trail Blazers, Portland Trail Blazer, L, 240, 41, 89, .461, 6, 21, .286, 22, 29, .759, 14, 25, 39, 15, 4, 0, 7, 22, 110  ,139.330948419,58.9265509302
Memphis Grizzlies at Miami Heat, Memphis Grizzlies, L, 240, 40, 77, .519, 7, 19, .368, 10, 14, .714, 5, 28, 33, 23, 10, 3, 13, 21, 97  ,126.082561157,46.9424003803
Memphis Grizzlies at Miami Heat, Miami Hea, W, 240, 37, 77, .481, 7, 22, .318, 19, 23, .826, 7, 28, 35, 18, 9, 1, 10, 15, 100  ,127.20823715,49.2903009436
Utah Jazz at Oklahoma City Thunder, Utah Jazz, L, 265, 39, 94, .415, 8, 22, .364, 12, 20, .600, 16, 28, 44, 14, 6, 2, 11, 24, 98  ,130.295910574,69.1811210031
Utah Jazz at Oklahoma City Thunder, Oklahoma City Thunde, W, 265, 35, 79, .443, 7, 21, .333, 27, 30, .900, 8, 34, 42, 18, 7, 13, 10, 18, 104  ,131.018518881,53.8109056278
Minnesota Timberwolves at Phoenix Suns, Minnesota Timberwolves, L, 240, 33, 73, .452, 8, 19, .421, 27, 34, .794, 9, 29, 38, 22, 7, 4, 24, 26, 101  ,126.915962562,47.9556129138
Minnesota Timberwolves at Phoenix Suns, Phoenix Sun, W, 240, 39, 87, .448, 10, 30, .333, 20, 24, .833, 12, 26, 38, 28, 16, 8, 14, 26, 108  ,141.534771191,58.1862171419
Philadelphia 76ers at Toronto Raptors, Philadelphia 76ers, L, 240, 28, 84, .333, 10, 28, .357, 10, 14, .714, 15, 37, 52, 18, 1, 9, 22, 20, 76  ,108.686283991,74.3377008876
Philadelphia 76ers at Toronto Raptors, Toronto Raptor, W, 240, 32, 78, .410, 7, 22, .318, 25, 34, .735, 8, 33, 41, 14, 11, 9, 8, 15, 96  ,122.066387143,55.3248635562
Miami Heat at Atlanta Hawks, Miami Heat, W, 240, 40, 89, .449, 7, 16, .438, 13, 15, .867, 15, 39, 54, 26, 6, 5, 15, 16, 100  ,134.028452318,68.4483586621
Miami Heat at Atlanta Hawks, Atlanta Hawk, L, 240, 33, 84, .393, 8, 33, .242, 14, 15, .933, 7, 30, 37, 25, 7, 4, 14, 21, 88  ,121.014862282,60.4016509996
Orlando Magic at Brooklyn Nets, Orlando Magic, W, 240, 41, 76, .539, 9, 21, .429, 14, 20, .700, 7, 36, 43, 24, 12, 3, 16, 18, 105  ,134.926327943,51.1144288127
Orlando Magic at Brooklyn Nets, Brooklyn Net, L, 240, 31, 80, .388, 7, 19, .368, 13, 16, .813, 9, 30, 39, 23, 5, 0, 17, 19, 82  ,111.783096956,57.9052584637
Philadelphia 76ers at Chicago Bulls, Philadelphia 76ers, L, 240, 38, 92, .413, 11, 31, .355, 9, 13, .692, 9, 27, 36, 19, 6, 8, 11, 17, 96  ,129.848672986,63.3241043198
Philadelphia 76ers at Chicago Bulls, Chicago Bull, W, 240, 43, 85, .506, 8, 22, .364, 21, 26, .808, 10, 43, 53, 28, 7, 8, 13, 15, 115  ,148.234342257,61.0395882295
Phoenix Suns at Dallas Mavericks, Phoenix Suns, L, 240, 33, 80, .413, 9, 25, .360, 19, 27, .704, 12, 35, 47, 19, 9, 5, 16, 23, 94  ,123.8289262,62.2277991426
Phoenix Suns at Dallas Mavericks, Dallas Maverick, W, 240, 38, 77, .494, 12, 32, .375, 16, 21, .762, 5, 36, 41, 17, 12, 1, 16, 22, 104  ,133.503765728,53.6304753401
Houston Rockets at Denver Nuggets, Houston Rockets, L, 240, 41, 87, .471, 18, 40, .450, 8, 11, .727, 5, 21, 26, 26, 14, 1, 11, 22, 108  ,142.943890501,51.4131306978
Houston Rockets at Denver Nuggets, Denver Nugget, W, 240, 42, 82, .512, 8, 25, .320, 22, 25, .880, 15, 37, 52, 26, 8, 5, 18, 15, 114  ,146.437347883,61.3740609301
Los Angeles Clippers at Detroit Pistons, Los Angeles Clippers, W, 265, 44, 97, .454, 6, 19, .316, 11, 15, .733, 10, 29, 39, 29, 9, 4, 10, 22, 105  ,140.783827699,62.2869677377
Los Angeles Clippers at Detroit Pistons, Detroit Piston, L, 265, 37, 89, .416, 6, 19, .316, 23, 31, .742, 15, 39, 54, 17, 8, 0, 18, 21, 103  ,133.765256615,69.3035290453
Toronto Raptors at Indiana Pacers, Toronto Raptors, L, 240, 29, 79, .367, 10, 28, .357, 22, 26, .846, 15, 30, 45, 10, 9, 6, 18, 21, 90  ,117.213550101,64.062743621
Toronto Raptors at Indiana Pacers, Indiana Pacer, W, 240, 41, 86, .477, 10, 22, .455, 14, 16, .875, 10, 34, 44, 14, 8, 3, 14, 21, 106  ,136.066443321,59.9174368069
Washington Wizards at Memphis Grizzlies, Washington Wizards, L, 240, 37, 86, .430, 9, 24, .375, 12, 20, .600, 10, 26, 36, 22, 9, 3, 14, 13, 95  ,126.721487824,58.0964617278
Washington Wizards at Memphis Grizzlies, Memphis Grizzlie, W, 240, 44, 78, .564, 10, 15, .667, 14, 15, .933, 6, 33, 39, 26, 8, 5, 17, 18, 112  ,141.582023262,46.1466777347
New Orleans Pelicans at Portland Trail Blazers, New Orleans Pelicans, L, 240, 36, 82, .439, 8, 25, .320, 21, 27, .778, 5, 36, 41, 15, 9, 9, 9, 22, 101  ,129.269726907,56.1375195457
New Orleans Pelicans at Portland Trail Blazers, Portland Trail Blazer, W, 240, 35, 81, .432, 13, 32, .406, 22, 29, .759, 10, 40, 50, 28, 7, 5, 15, 21, 105  ,138.208280053,62.0864370602
Utah Jazz at San Antonio Spurs, Utah Jazz, L, 240, 32, 79, .405, 3, 11, .273, 14, 17, .824, 7, 25, 32, 18, 8, 3, 11, 23, 81  ,107.213299555,51.1513194338
Utah Jazz at San Antonio Spurs, San Antonio Spur, W, 240, 42, 75, .560, 9, 21, .429, 25, 27, .926, 9, 39, 48, 24, 6, 2, 11, 17, 118  ,146.716118816,50.6890704095
Cleveland Cavaliers at Boston Celtics, Cleveland Cavaliers, W, 240, 36, 78, .462, 8, 23, .348, 9, 10, .900, 6, 40, 46, 17, 5, 7, 14, 17, 89  ,118.803151288,59.1953872019
Cleveland Cavaliers at Boston Celtics, Boston Celtic, L, 240, 28, 87, .322, 9, 32, .281, 12, 14, .857, 12, 29, 41, 18, 6, 6, 10, 11, 77  ,109.510265473,69.6303678894
Milwaukee Bucks at Los Angeles Lakers, Milwaukee Bucks, L, 240, 40, 85, .471, 4, 13, .308, 11, 20, .550, 12, 26, 38, 23, 7, 7, 11, 20, 95  ,125.532975116,56.3333102541
Milwaukee Bucks at Los Angeles Lakers, Los Angeles Laker, W, 240, 41, 89, .461, 10, 27, .370, 21, 25, .840, 18, 34, 52, 26, 7, 3, 14, 18, 113  ,147.528951674,67.6543086574
Denver Nuggets at Minnesota Timberwolves, Denver Nuggets, W, 240, 41, 73, .562, 10, 18, .556, 20, 27, .741, 10, 29, 39, 24, 9, 6, 14, 26, 112  ,139.623512638,45.2824479476
Denver Nuggets at Minnesota Timberwolves, Minnesota Timberwolve, L, 240, 36, 77, .468, 4, 10, .400, 24, 31, .774, 10, 21, 31, 21, 6, 6, 9, 24, 100  ,125.028935507,44.7455183275
Houston Rockets at Sacramento Kings, Houston Rockets, L, 240, 34, 82, .415, 12, 39, .308, 17, 23, .739, 7, 29, 36, 22, 17, 3, 21, 28, 97  ,129.258514525,57.9110491606
Houston Rockets at Sacramento Kings, Sacramento King, W, 240, 38, 75, .507, 11, 24, .458, 20, 29, .690, 9, 38, 47, 25, 13, 3, 28, 19, 107  ,136.924224634,53.7413739448
Philadelphia 76ers at Atlanta Hawks, Philadelphia 76ers, L, 240, 39, 75, .520, 12, 26, .462, 16, 24, .667, 7, 25, 32, 20, 5, 2, 22, 21, 106  ,134.056498399,45.438688415
Philadelphia 76ers at Atlanta Hawks, Atlanta Hawk, W, 240, 48, 78, .615, 10, 21, .476, 21, 24, .875, 2, 23, 25, 32, 11, 7, 12, 21, 127  ,156.588574269,33.7003431397
Miami Heat at Brooklyn Nets, Miami Heat, W, 240, 40, 75, .533, 7, 21, .333, 17, 24, .708, 8, 37, 45, 16, 4, 6, 12, 13, 104  ,131.514735429,52.922024821
Miami Heat at Brooklyn Nets, Brooklyn Net, L, 240, 42, 89, .472, 4, 16, .250, 10, 14, .714, 10, 25, 35, 24, 6, 3, 6, 18, 98  ,129.984663191,56.3288981764
Memphis Grizzlies at Chicago Bulls, Memphis Grizzlies, L, 240, 32, 76, .421, 5, 19, .263, 16, 28, .571, 5, 36, 41, 27, 6, 5, 13, 20, 85  ,114.53736007,54.0723704591
Memphis Grizzlies at Chicago Bulls, Chicago Bull, W, 240, 38, 86, .442, 9, 24, .375, 13, 19, .684, 9, 36, 45, 22, 5, 6, 14, 17, 98  ,130.46654734,62.2135382599
Boston Celtics at Detroit Pistons, Boston Celtics, L, 240, 43, 89, .483, 10, 25, .400, 20, 24, .833, 10, 34, 44, 17, 4, 2, 18, 35, 116  ,147.145058689,59.7317505957
Boston Celtics at Detroit Pistons, Detroit Piston, W, 240, 38, 78, .487, 11, 21, .524, 32, 43, .744, 7, 29, 36, 13, 5, 4, 11, 22, 119  ,143.297694044,45.752788269
Phoenix Suns at Golden State Warriors, Phoenix Suns, L, 240, 41, 91, .451, 5, 22, .227, 16, 18, .889, 7, 34, 41, 28, 11, 4, 20, 20, 103  ,136.955272805,60.0903860569
Phoenix Suns at Golden State Warriors, Golden State Warrior, W, 240, 46, 88, .523, 15, 32, .469, 21, 27, .778, 9, 40, 49, 32, 12, 4, 17, 17, 128  ,164.095889749,59.0073119594
Dallas Mavericks at Indiana Pacers, Dallas Mavericks, L, 240, 33, 90, .367, 8, 33, .242, 7, 10, .700, 11, 36, 47, 16, 2, 3, 11, 16, 81  ,115.281446114,73.9191224817
Dallas Mavericks at Indiana Pacers, Indiana Pacer, W, 240, 43, 89, .483, 11, 29, .379, 10, 17, .588, 5, 42, 47, 28, 9, 4, 8, 17, 107  ,143.035280469,62.2529264701
Milwaukee Bucks at Los Angeles Clippers, Milwaukee Bucks, L, 240, 38, 88, .432, 5, 16, .313, 9, 11, .818, 15, 26, 41, 21, 9, 6, 11, 21, 90  ,121.807568287,63.2691700176
Milwaukee Bucks at Los Angeles Clippers, Los Angeles Clipper, W, 240, 36, 75, .480, 11, 21, .524, 20, 24, .833, 10, 30, 40, 25, 7, 4, 14, 10, 103  ,131.733202629,50.3349627732
Minnesota Timberwolves at New York Knicks, Minnesota Timberwolves, L, 240, 42, 101, .416, 4, 21, .190, 14, 14, 1.000, 16, 34, 50, 21, 12, 2, 7, 23, 102  ,137.838110214,75.2644469156
Minnesota Timberwolves at New York Knicks, New York Knick, W, 240, 37, 85, .435, 8, 21, .381, 25, 30, .833, 14, 36, 50, 28, 2, 10, 14, 17, 107  ,139.160031737,62.6492418201
Portland Trail Blazers at Oklahoma City Thunder, Portland Trail Blazers, L, 240, 32, 92, .348, 11, 26, .423, 15, 18, .833, 17, 30, 47, 13, 6, 3, 18, 28, 90  ,121.909417794,73.3791253398
Portland Trail Blazers at Oklahoma City Thunder, Oklahoma City Thunde, W, 240, 38, 79, .481, 2, 14, .143, 28, 37, .757, 14, 37, 51, 13, 6, 8, 18, 20, 106  ,131.749896494,59.0670378888
Charlotte Hornets at Orlando Magic, Charlotte Hornets, L, 240, 36, 79, .456, 14, 34, .412, 12, 15, .800, 7, 26, 33, 23, 12, 3, 16, 19, 98  ,129.521658423,52.5272397852
Charlotte Hornets at Orlando Magic, Orlando Magi, W, 240, 43, 77, .558, 14, 24, .583, 13, 15, .867, 4, 36, 40, 28, 12, 4, 17, 15, 113  ,144.39282754,47.2930035401
Washington Wizards at San Antonio Spurs, Washington Wizards, L, 240, 35, 84, .417, 3, 15, .200, 22, 25, .880, 10, 28, 38, 22, 6, 4, 12, 18, 95  ,123.582012911,55.8478767885
Washington Wizards at San Antonio Spurs, San Antonio Spur, W, 240, 44, 83, .530, 8, 22, .364, 18, 23, .783, 8, 35, 43, 29, 10, 9, 11, 21, 114  ,146.433425267,53.3893174669
New Orleans Pelicans at Utah Jazz, New Orleans Pelicans, W, 240, 34, 73, .466, 10, 21, .476, 26, 28, .929, 8, 28, 36, 14, 9, 2, 10, 24, 104  ,128.200272865,46.7812707843
New Orleans Pelicans at Utah Jazz, Utah Jaz, L, 240, 32, 67, .478, 7, 20, .350, 23, 29, .793, 5, 29, 34, 17, 4, 4, 12, 20, 94  ,117.515219041,42.9313249868
Toronto Raptors at Charlotte Hornets, Toronto Raptors, L, 265, 35, 97, .361, 9, 39, .231, 20, 28, .714, 9, 37, 46, 18, 7, 10, 8, 22, 99  ,134.306896918,73.8637750839
Toronto Raptors at Charlotte Hornets, Charlotte Hornet, W, 265, 37, 85, .435, 10, 29, .345, 25, 31, .806, 6, 45, 51, 23, 5, 9, 13, 23, 109  ,141.009302721,62.5027141334
Oklahoma City Thunder at Cleveland Cavaliers, Oklahoma City Thunder, L, 240, 35, 74, .473, 6, 20, .300, 24, 28, .857, 9, 27, 36, 23, 7, 7, 12, 20, 100  ,126.841577906,47.7874581399
Oklahoma City Thunder at Cleveland Cavaliers, Cleveland Cavalier, W, 240, 41, 88, .466, 12, 29, .414, 10, 13, .769, 16, 26, 42, 29, 6, 1, 16, 22, 104  ,139.869447436,63.0558471271
